{
  "version": 1,
  "project": "outputs/demo",
  "created_at": "2026-06-18T00:00:00Z",
  "updated_at": "2026-06-18T00:00:00Z",
  "artifacts": {
    "video": {
      "source": "outputs/demo/internal/draft.mp4",
      "final": "outputs/demo/final/final.mp4"
    },
    "cover": {
      "source": "outputs/demo/internal/cover.png",
      "vertical": "outputs/demo/internal/cover_publish_vertical.png",
      "horizontal": "outputs/demo/internal/cover_publish_horizontal.png",
      "text_source": "outputs/demo/internal/publish_cover_text.txt",
      "report": "outputs/demo/internal/publish_cover_report.json"
    },
    "metadata": {
      "source": "outputs/demo/internal/metadata.json",
      "final": "outputs/demo/final/metadata.json"
    },
    "publish_copy": {
      "source": "outputs/demo/internal/publish_copy.txt",
      "final": "outputs/demo/final/publish_copy.txt"
    }
  },
  "publish": {
    "title": "测试标题",
    "caption": "发布文案",
    "topics": ["#AI工具"],
    "first_topic": "#AI工具"
  },
  "checks": {
    "qa_report": {
      "path": "outputs/demo/internal/qa_report.json",
      "status": "passed"
    },
    "visual_regression_gate": {
      "path": "outputs/demo/internal/visual_regression_gate.json",
      "status": "passed"
    },
    "provider_usage_audit": {
      "path": "outputs/demo/internal/provider_usage_audit.json",
      "status": "passed"
    },
    "qingdou_keyword_check": {
      "path": "outputs/demo/internal/qingdou_keyword_check.json",
      "status": "passed"
    },
    "text_compliance": {
      "path": "outputs/demo/internal/on_screen_and_publish_text_compliance_report.json",
      "status": "passed"
    },
    "cover": {
      "path": "outputs/demo/internal/publish_cover_report.json",
      "status": "passed"
    }
  },
  "gate": {
    "status": "passed",
    "issues": [],
    "verified_at": "2026-06-18T00:00:00Z"
  }
}
